{
  "format_version": 2,
  "id": "org.popugonet.popugvpocket.pixelclock",
  "name": "Pixel Clock",
  "version": "1.1.0",
  "type": "app",
  "entry_scene": "res://cartridges/org.popugonet.popugvpocket.pixelclock/main.tscn",
  "sdk_version": "0.5.1",
  "runtime": {"min_version": "0.5.1", "max_version": null},
  "author": {"name": "PopugVPocket Examples", "url": ""},
  "description": "Large pixel clock with stopwatch, timer, and display style setting.",
  "category": "utility",
  "icon": "icon.png",
  "license": "MIT",
  "capabilities": ["storage", "audio", "theme", "system_menu"],
  "permissions": [],
  "content": {"file": "content.pck", "sha256": "0000000000000000000000000000000000000000000000000000000000000000"},
  "signature": null,
  "store": {"featured": true, "tags": ["clock", "timer", "utility"]}
}
