{
  "format_version": 2, "id": "org.popugonet.popugvpocket.dice", "name": "Pocket Dice", "version": "1.0.0", "type": "app",
  "entry_scene": "res://cartridges/org.popugonet.popugvpocket.dice/main.tscn", "sdk_version": "0.5.0",
  "runtime": {"min_version": "0.5.0", "max_version": null}, "author": {"name": "PopugVPocket Examples", "url": ""},
  "description": "D4 through D20 with history.", "category": "utility", "icon": "icon.png", "license": "MIT",
  "capabilities": ["storage", "audio", "theme", "system_menu"], "permissions": [],
  "content": {"file": "content.pck", "sha256": "0000000000000000000000000000000000000000000000000000000000000000"},
  "signature": null, "store": {"featured": true, "tags": ["dice", "tabletop"]}
}
